{
  "id": "9b4d6e83-2a5c-4f17-8d60-3e7a1c9b5f08",
  "kind": "policy",
  "name": "ClerkAccess",
  "formatVersion": 1,
  "roles": ["clerk"],
  "grants": [
    { "entity": "Order", "actions": ["read"] },
    { "entity": "reviews/Review", "actions": ["read"] },
    { "process": "CloseReview", "actions": ["start"] },
    { "process": "FlagReview", "actions": ["start"] }
  ]
}
